### ISSUE TITLE
Getting some troubles to use the Polaris-gslb

### ISSUE THREAD

**Issue by franckMess** [polaris-gslb/polaris-core#66]
Hello guys;
I'm trying to use this load balancer in my setup but I'm getting some troubles to make it work. 
my setup is composed of:
- 02 gateways,
- 02 servers,
- the Polaris gslb which also hosts the DNS server (powerDNS)
- 01 client to sned dig or nslookup requests.
Please check the attached picture for more details about the topology.
![image](https://user-images.githubusercontent.com/65412746/92895431-c6832800-f41b-11ea-868c-85da3f746279.png)
Concerning the configuration of the polaris-gdlb, I have configured the files as follow:
---------------------------------------------------------------------------------------------------------
polaris-health.yaml
---------------------------------------------------------------------------------------------------------
 SHARED_MEM_HOSTNAME: 127.0.0.1
 SHARED_MEM_SERVER_MAX_VALUE_LENGTH: 1048576

-----------------------------------------------------------------------------------------------------------------------------------------
cat polaris-lb.yaml
-----------------------------------------------------------------------------------------------------------------------------------------
pools:
    www-example:
        monitor: http
        monitor_params:
            use_ssl: false
            hostname: www.example.com
            url_path: /index.html
            expected_codes: 
            - 200
        lb_method: twrr 
        fallback: any
        members:
        - ip: 192.168.100.9
          name: www1-dc1
          weight: 1
        - ip: 192.168.101.9
          name: www2-dc2
          weight: 1
        
globalnames:
    www.example.com:
        pool: www-example
        ttl: 1

-----------------------------------------------------------------------------------------------------------------------------------------
polaris-pdns.yaml
-----------------------------------------------------------------------------------------------------------------------------------------
 SOA_MNAME: example.com.
 SOA_RNAME: localhost.admin.example.com.
 SOA_SERIAL: 1
 SOA_REFRESH: 3600
 SOA_RETRY: 600
 SOA_EXPIRE: 86400
 SOA_MINIMUM: 1
 SOA_TTL: 86400
 LOG: true
 SHARED_MEM_HOSTNAME: 127.0.0.1

------------------------------------------------------------------------------------------------------------------------------------------------------
polaris-topology.yaml
------------------------------------------------------------------------------------------------------------------------------------------------------
datacenter1:
- 192.168.101.0/24

datacenter2:
- 192.168.100.0/24

++++++++++++++++++++++++++++++++++++++++++++++++++++++++++
for the /etc/pdns/pdns.conf, I used this configuration:
# Polaris specific PDNS configuration

 launch=remote
 remote-connection-string=http:url=http://localhost:63636/dns,url-suffix=.php
 loglevel=9
 cache-ttl=20
 negquery-cache-ttl=60
 query-cache-ttl=20

+++++++++++++++++++++++++++++++++++++++++++++++++++++++++++++++++++++++++++++++++++
Finally, as I'm getting confused between the directory /etc/pdns and /etc/powerdns, I also defined a config under this directory (i.e., /etc/powerdns/pdns.conf), the file is large so I attached it here 
[pdns.txt](https://github.com/polaris-gslb/polaris-gslb/files/5207866/pdns.txt)
+++++++++++++++++++++++++++++++++++++++++++++++++++++++++++++++++++
Having this setup in hand. To use only the PowerDns, I have created a mySQL database, when I request fro a nslookup/dig from the client towards this PowerDns I got what is needed, however, I guess no need for a database in the case of Polaris-gslb as it used a shared memory. 
Please correct me if I'm wrong.
Now If I do an $"nslookup www.example.com 10.10.10.52" form the client (10.10.10.55) I'm getting a connection timeout [;; connection timed out; no servers could be reached]. Ic hecked that the request is sent to the PowerDns via a tcpdump:
09:12:54.235110 IP 10.10.10.55.46457 > 10.10.10.52.53: 61592+ AAAA? client. (24)
09:12:54.235155 IP 10.10.10.55.50471 > 10.10.10.52.53: 47218+ AAAA? client. (24)
09:12:54.235402 IP 10.10.10.55.42844 > 10.10.10.52.53: 61592+ AAAA? client. (24)
09:12:54.235538 IP 10.10.10.55.33959 > 10.10.10.52.53: 50385+ A? client. (24)
09:12:54.235630 IP 10.10.10.55.50233 > 10.10.10.52.53: 50385+ A? client. (24)
09:12:54.235642 IP 10.10.10.55.50558 > 10.10.10.52.53: 47218+ AAAA? client. (24)
09:12:57.202695 IP 10.10.10.55.53935 > 10.10.10.52.53: 27144+ A? www.example.com. (33)

and on the Polaris-GSLB &PowerDns I have these info from tcpdump:
09:12:54.914939 IP 10.10.10.55.55590 > 10.10.10.52.53: 19494+ A? client. (24)
09:12:54.914980 IP 10.10.10.55.55590 > 10.10.10.52.53: 2603+ AAAA? client. (24)
09:12:54.915181 IP 10.10.10.55.55541 > 10.10.10.52.53: 19494+ A? client. (24)
09:12:54.915196 IP 10.10.10.55.55541 > 10.10.10.52.53: 2603+ AAAA? client. (24)
09:12:54.915331 IP 10.10.10.55.46065 > 10.10.10.52.53: 37946+ A? client. (24)
09:12:54.915346 IP 10.10.10.55.46065 > 10.10.10.52.53: 49213+ AAAA? client. (24)
09:12:54.915442 IP 10.10.10.55.42835 > 10.10.10.52.53: 37946+ A? client. (24)
09:12:54.915446 IP 10.10.10.55.42835 > 10.10.10.52.53: 49213+ AAAA? client. (24)
09:12:57.905266 IP 10.10.10.55.53935 > 10.10.10.52.53: 27144+ A? www.example.com. (33)
09:12:59.937458 IP 10.10.10.55.46457 > 10.10.10.52.53: 61592+ AAAA? client. (24)
09:12:59.937497 IP 10.10.10.55.50471 > 10.10.10.52.53: 47218+ AAAA? client. (24)
09:12:59.937685 IP 10.10.10.55.42844 > 10.10.10.52.53: 61592+ AAAA? client. (24)
09:12:59.937818 IP 10.10.10.55.33959 > 10.10.10.52.53: 50385+ A? client. (24)
09:12:59.937908 IP 10.10.10.55.50233 > 10.10.10.52.53: 50385+ A? client. (24)
09:12:59.937912 IP 10.10.10.55.50558 > 10.10.10.52.53: 47218+ AAAA? client. (24)
09:13:02.905099 IP 10.10.10.55.53935 > 10.10.10.52.53: 27144+ A? www.example.com. (33)
09:13:04.945661 IP 10.10.10.55.33714 > 10.10.10.52.53: 1751+ A? client. (24)
09:13:04.945944 IP 10.10.10.55.36332 > 10.10.10.52.53: 1751+ A? client. (24)
09:13:04.982211 IP 10.10.10.55.49813 > 10.10.10.52.53: 8780+ AAAA? client. (24)
09:13:04.982526 IP 10.10.10.55.41784 > 10.10.10.52.53: 8780+ AAAA? client. (24)
09:13:04.982670 IP 10.10.10.55.58538 > 10.10.10.52.53: 13471+ A? client. (24)
09:13:04.991459 IP 10.10.10.55.32926 > 10.10.10.52.53: 12539+ AAAA? client. (24)
09:13:07.905126 IP 10.10.10.55.53935 > 10.10.10.52.53: 27144+ A? www.example.com. (33)
09:13:09.987848 IP 10.10.10.55.58538 > 10.10.10.52.53: 13471+ A? client. (24)
09:13:09.993476 IP 10.10.10.55.32926 > 10.10.10.52.53: 12539+ AAAA? client. (24)
09:13:09.993773 IP 10.10.10.55.37357 > 10.10.10.52.53: 45583+ A? client. (24)
09:13:09.993879 IP 10.10.10.55.46473 > 10.10.10.52.53: 45583+ A? client. (24)

When I start the polaris-health in debug mode (/opt/polaris/bin/polaris-health start-debug) I got the following:
2020-09-11 09:07:25,707 [INFO] polaris_health.guardian: starting Polaris health
2020-09-11 09:07:26,473 [DEBUG] polaris_health.tracker: received Probe(pool: www-example member_ip: 192.168.100.9 monitor: HTTP monitor_ip: 192.168.100.9 status: True status_reason: monitor passed 
2020-09-11 09:07:26,473 [INFO] polaris_health.tracker: pool member status change: member 192.168.100.9(name: www1-dc1 monitor IP: 192.168.100.9) of pool www-example is UP, reason: monitor passed
2020-09-11 09:07:26,474 [INFO] polaris_health.tracker: pool status change: pool www-example is UP
2020-09-11 09:07:26,675 [DEBUG] polaris_health.tracker: received Probe(pool: www-example member_ip: 192.168.101.9 monitor: HTTP monitor_ip: 192.168.101.9 status: True status_reason: monitor passed 
2020-09-11 09:07:26,675 [INFO] polaris_health.tracker: pool member status change: member 192.168.101.9(name: www2-dc2 monitor IP: 192.168.101.9) of pool www-example is UP, reason: monitor passed
2020-09-11 09:07:26,719 [INFO] polaris_health.state: health status convergence complete
2020-09-11 09:07:26,724 [DEBUG] polaris_health.tracker: synced state to the shared memory
2020-09-11 09:07:36,521 [DEBUG] polaris_health.tracker: received Probe(pool: www-example member_ip: 192.168.100.9 monitor: HTTP monitor_ip: 192.168.100.9 status: True status_reason: monitor passed 
2020-09-11 09:07:36,723 [DEBUG] polaris_health.tracker: received Probe(pool: www-example member_ip: 192.168.101.9 monitor: HTTP monitor_ip: 192.168.101.9 status: True status_reason: monitor passed 
2020-09-11 09:07:46,569 [DEBUG] polaris_health.tracker: received Probe(pool: www-example member_ip: 192.168.100.9 monitor: HTTP monitor_ip: 192.168.100.9 status: True status_reason: monitor passed 
2020-09-11 09:07:46,771 [DEBUG] polaris_health.tracker: received Probe(pool: www-example member_ip: 192.168.101.9 monitor: HTTP monitor_ip: 192.168.101.9 status: True status_reason: monitor passed 
2020-09-11 09:07:55,728 [DEBUG] polaris_health.prober: running threads cleanup, threads total: 25 max busy: 0
2020-09-11 09:07:55,729 [DEBUG] polaris_health.prober: excessive threads detected, total: 25 max busy: 0, scheduling termination of 24 threads

/opt/polaris/bin/check-pdns returned PONG ok

./polaris-memcache-control 127.0.0.1 get-ppdns-state
{
    "timestamp": 1599815246.7199855,
    "pools": {
        "www-example": {
            "status": true,
            "lb_method": "twrr",
            "fallback": "any",
            "max_addrs_returned": 1,
            "dist_tables": {
                "_default": {
                    "rotation": [
                        "192.168.100.9",
                        "192.168.101.9"
                    ],
                    "num_unique_addrs": 2,
                    "index": 0
                },
                "datacenter2": {
                    "rotation": [
                        "192.168.100.9"
                    ],
                    "num_unique_addrs": 1,
                    "index": 0
                },
                "datacenter1": {
                    "rotation": [
                        "192.168.101.9"
                    ],
                    "num_unique_addrs": 1,
                    "index": 0
                }
            }
        }
    },
    "globalnames": {
        "www.example.com": {
            "pool_name": "www-example",
            "ttl": 1
        }
    }
}

I do not see where the problem comes from... can someone help please?
In advance thank you
